DROP DATABASE IF EXISTS sh_txn_types;
Warnings:
Note	1008	Can't drop database 'sh_txn_types'; database doesn't exist
CREATE DATABASE sh_txn_types;
USE sh_txn_types;
CREATE TABLE t_types (
id INT PRIMARY KEY,
bin16 BINARY(16),
b BLOB,
d DECIMAL(12,4),
ts TIMESTAMP NULL DEFAULT NULL,
j JSON,
name VARCHAR(64)
) SECONDARY_ENGINE=RAPID;
INSERT INTO t_types VALUES
(1, 0x000102030405060708090A0B0C0D0E0F, 'aaa', 1.2345, '2020-01-01 00:00:00', JSON_OBJECT('a',1), 'Alice'),
(2, 0x1112131415161718191A1B1C1D1E1F20, 'bbb', 2.5000, '2020-02-02 12:34:56', JSON_OBJECT('b',2), 'Bob');
ALTER TABLE t_types SECONDARY_LOAD;
SET SESSION USE_SECONDARY_ENGINE=OFF;
BEGIN;
UPDATE t_types SET b = 'ZZZ', d = 9.9999, ts = '2026-01-01 01:02:03', j = JSON_OBJECT('x',99), name = 'E1' WHERE id = 1;
SELECT id, OCTET_LENGTH(b), d, ts, JSON_EXTRACT(j, '$.x'), name FROM t_types WHERE id = 1;
id	OCTET_LENGTH(b)	d	ts	JSON_EXTRACT(j, '$.x')	name
1	3	9.9999	2026-01-01 01:02:03	99	E1
SET SESSION USE_SECONDARY_ENGINE=FORCED;
SELECT id, OCTET_LENGTH(b), d, ts, JSON_EXTRACT(j, '$.x'), name FROM t_types WHERE id = 1;
id	OCTET_LENGTH(b)	d	ts	JSON_EXTRACT(j, '$.x')	name
1	3	1.2345	2020-01-01 00:00:00	NULL	Alice
ROLLBACK;
SET SESSION USE_SECONDARY_ENGINE=FORCED;
SELECT id, OCTET_LENGTH(b), d, ts, JSON_EXTRACT(j, '$.x'), name FROM t_types WHERE id = 1;
id	OCTET_LENGTH(b)	d	ts	JSON_EXTRACT(j, '$.x')	name
1	3	1.2345	2020-01-01 00:00:00	NULL	Alice
SET SESSION USE_SECONDARY_ENGINE=OFF;
BEGIN;
UPDATE t_types SET b = 'YYY', d = 8.8888, ts = '2026-02-02 02:02:02', j = JSON_OBJECT('y',42), name = 'E2' WHERE id = 2;
COMMIT;
SET SESSION USE_SECONDARY_ENGINE=FORCED;
SELECT id, OCTET_LENGTH(b), d, ts, JSON_EXTRACT(j, '$.y'), name FROM t_types WHERE id = 2;
id	OCTET_LENGTH(b)	d	ts	JSON_EXTRACT(j, '$.y')	name
2	3	8.8888	2026-02-02 02:02:02	42	E2
DROP TABLE t_types;
DROP DATABASE sh_txn_types;
