create database test_query;
use test_query;
create table tt (score int, name char(10), id int, gender char(1)) secondary_engine=rapid;
#connection_1 and cconnection_2
#[conn_1]
set use_secondary_engine=forced;
alter table tt secondary_load;
show variables  like '%use_secondary_engine%' ;
Variable_name	Value
use_secondary_engine	FORCED
select * from tt order by id;
score	name	id	gender
explain select * from tt order by id;
id	select_type	table	partitions	type	possible_keys	key	key_len	ref	rows	filtered	Extra
1	SIMPLE	tt	NULL	ALL	NULL	NULL	NULL	NULL	1	100.00	Using filesort; Using secondary engine Rapid
[conn2]
set use_secondary_engine=off;
show variables  like '%use_secondary_engine%' ;
Variable_name	Value
use_secondary_engine	OFF
insert into tt values(1, 'n1', 1, 'a');
select * from tt order by id;
score	name	id	gender
1	n1	1	a
insert into tt values (2,'n2',2,'b'),(3,'n3',3,'c'),(4,'n4',4,'d');
select * from tt order by id;
score	name	id	gender
1	n1	1	a
2	n2	2	b
3	n3	3	c
4	n4	4	d
explain select * from tt order by id;
id	select_type	table	partitions	type	possible_keys	key	key_len	ref	rows	filtered	Extra
1	SIMPLE	tt	NULL	ALL	NULL	NULL	NULL	NULL	4	100.00	Using filesort
[conn1_after_insertion]
select * from tt order by id;
score	name	id	gender
1	n1	1	a
2	n2	2	b
3	n3	3	c
4	n4	4	d
explain select * from tt order by id;
id	select_type	table	partitions	type	possible_keys	key	key_len	ref	rows	filtered	Extra
1	SIMPLE	tt	NULL	ALL	NULL	NULL	NULL	NULL	4	100.00	Using filesort; Using secondary engine Rapid
[conn2]
delete from tt where id =3;
select * from tt order by id;
score	name	id	gender
1	n1	1	a
2	n2	2	b
4	n4	4	d
[conn1]
select * from tt order by id;
score	name	id	gender
1	n1	1	a
4	n4	4	d
4	n4	4	d
drop table tt;
drop database test_query;
