DROP DATABASE IF EXISTS sh_savepoint;
CREATE DATABASE sh_savepoint;
USE sh_savepoint;
CALL mtr.add_suppression("Rapid immediate COPY_INFO quarantined");
CREATE TABLE t_sp (
id INT PRIMARY KEY,
v INT,
name VARCHAR(64)
) SECONDARY_ENGINE=RAPID;
INSERT INTO t_sp VALUES (1, 10, 'A'), (2, 20, 'B');
ALTER TABLE t_sp SECONDARY_LOAD;
SET SESSION USE_SECONDARY_ENGINE=OFF;
BEGIN;
UPDATE t_sp SET v = v + 1 WHERE id = 1;
SAVEPOINT s1;
UPDATE t_sp SET v = v + 2 WHERE id = 1;
SELECT id, v FROM t_sp WHERE id = 1;
id	v
1	13
SET SESSION USE_SECONDARY_ENGINE=OFF;
SELECT id, v FROM t_sp WHERE id = 1;
id	v
1	10
ROLLBACK TO SAVEPOINT s1;
SELECT id, v FROM t_sp WHERE id = 1;
id	v
1	11
ROLLBACK;
SET SESSION USE_SECONDARY_ENGINE=FORCED;
SELECT id, v FROM t_sp WHERE id = 1;
ERROR HY000: Secondary engine operation failed. table has failed DML propagation and must be reloaded.
SET SESSION USE_SECONDARY_ENGINE=OFF;
ALTER TABLE t_sp SECONDARY_UNLOAD;
ALTER TABLE t_sp SECONDARY_LOAD;
SET SESSION USE_SECONDARY_ENGINE=FORCED;
SELECT id, v FROM t_sp WHERE id = 1;
id	v
1	10
SET SESSION USE_SECONDARY_ENGINE=OFF;
BEGIN;
UPDATE t_sp SET v = v + 100 WHERE id = 2;
SAVEPOINT s2;
UPDATE t_sp SET v = v + 200 WHERE id = 2;
ROLLBACK TO SAVEPOINT s2;
COMMIT;
ALTER TABLE t_sp SECONDARY_UNLOAD;
ALTER TABLE t_sp SECONDARY_LOAD;
SET SESSION USE_SECONDARY_ENGINE=FORCED;
SELECT id, v FROM t_sp WHERE id = 2;
id	v
2	120
DROP TABLE t_sp;
DROP DATABASE sh_savepoint;
