create database test_query;
use test_query;
create table tt (score int, name char(10), id int, gender char(1)) secondary_engine=rapid;
#connection_1 and cconnection_2
#[conn_1]
set use_secondary_engine=forced;
alter table tt secondary_load;
show variables  like '%use_secondary_engine%' ;
Variable_name	Value
use_secondary_engine	FORCED
select * from tt order by id;
score	name	id	gender
explain select * from tt order by id;
id	select_type	table	partitions	type	possible_keys	key	key_len	ref	rows	filtered	Extra
1	SIMPLE	tt	NULL	ALL	NULL	NULL	NULL	NULL	0	0.00	Using filesort; Using secondary engine Rapid
[conn2]
set use_secondary_engine=off;
show variables  like '%use_secondary_engine%' ;
Variable_name	Value
use_secondary_engine	OFF
insert into tt values(1, 'n1', 1, 'a');
select * from tt order by id;
score	name	id	gender
1	n1	1	a
insert into tt values (2,'n2',2,'b'),(3,'n3',3,'c'),(4,'第四',4,'d');
select * from tt order by id;
score	name	id	gender
1	n1	1	a
2	n2	2	b
3	n3	3	c
4	第四	4	d
explain select * from tt order by id;
id	select_type	table	partitions	type	possible_keys	key	key_len	ref	rows	filtered	Extra
1	SIMPLE	tt	NULL	ALL	NULL	NULL	NULL	NULL	4	100.00	Using filesort
[conn1_after_insertion]
select * from tt order by id;
score	name	id	gender
1	n1	1	a
2	n2	2	b
3	n3	3	c
4	第四	4	d
explain select * from tt order by id;
id	select_type	table	partitions	type	possible_keys	key	key_len	ref	rows	filtered	Extra
1	SIMPLE	tt	NULL	ALL	NULL	NULL	NULL	NULL	4	100.00	Using filesort; Using secondary engine Rapid
drop table tt;
create table tt (score int, name char(10), id int, gender char(1)) secondary_engine=rapid;
insert into tt values (2,'n2',2,'b'),(3,'n3',3,'c'),(4,'n4',4,'d'), (5,'n5', 5, 'e'), (51,'n52', 5, 'f');
alter table tt secondary_load;
select * from tt order by id;
score	name	id	gender
2	n2	2	b
3	n3	3	c
4	n4	4	d
5	n5	5	e
51	n52	5	f
[conn2]
update tt set score = 2 * score, name ='n55测试' where id =5;
select * from tt order by id;
score	name	id	gender
2	n2	2	b
3	n3	3	c
4	n4	4	d
10	n55测试	5	e
102	n55测试	5	f
[conn1]
select * from tt order by id;
score	name	id	gender
2	n2	2	b
3	n3	3	c
4	n4	4	d
10	n55测试	5	e
102	n55测试	5	f
explain select * from tt order by id;
id	select_type	table	partitions	type	possible_keys	key	key_len	ref	rows	filtered	Extra
1	SIMPLE	tt	NULL	ALL	NULL	NULL	NULL	NULL	5	100.00	Using filesort; Using secondary engine Rapid
create table tt2 (name char(10), gender char(1)) secondary_engine=rapid;
insert into tt2 values('n1', 'm'), ('n2', null), ('n3', 'm');
alter table tt2 secondary_load;
select * from tt2;
name	gender
n1	m
n2	NULL
n3	m
[conn2]
delete from tt2 where gender is null;
select * from tt2;
name	gender
n1	m
n3	m
[conn1]
select * from tt2;
name	gender
n1	m
n3	m
[conn2]
delete from tt2;
select * from tt2;
name	gender
[conn1]
select * from tt2;
name	gender
select * from tt;
score	name	id	gender
2	n2	2	b
3	n3	3	c
4	n4	4	d
10	n55测试	5	e
102	n55测试	5	f
drop table tt;
drop table tt2;
SELECT * FROM performance_schema.rpd_table_id;
ID	NAME	SCHEMA_NAME	TABLE_NAME
drop database test_query;
