DROP DATABASE IF EXISTS sh_bugfixes;
Warnings:
Note	1008	Can't drop database 'sh_bugfixes'; database doesn't exist
create database sh_bugfixes;
use sh_bugfixes;
SET USE_SECONDARY_ENGINE=FORCED;
########################################################################
# Bug 6: IS NOT NULL in vectorized paths
#
# The vectorized IS_NOT_NULL code used a two-way if/else pattern that
# fell through to the SIMD comparison mask default (all-zeros) for
# IS_NULL/IS_NOT_NULL ops.  On non-NULL rows this produced bit_array_reset
# (false) for every lane, effectively making IS NOT NULL a no-match
# predicate whenever num_rows >= simd_width (AVX2=4, SSE=2, NEON=4).
#
# This test inserts enough rows to hit the SIMD main loop for each type,
# then verifies that IS NOT NULL returns all non-NULL rows.
########################################################################
# 6a: BIGINT (int64 vectorized path, simd_width=4 with AVX2)
CREATE TABLE t_isnotnull_bigint (
id BIGINT PRIMARY KEY,
val BIGINT
) SECONDARY_ENGINE=RAPID;
INSERT INTO t_isnotnull_bigint VALUES
(1, 100), (2, NULL), (3, 200), (4, 300), (5, NULL), (6, 400), (7, 500), (8, NULL);
ALTER TABLE t_isnotnull_bigint SECONDARY_LOAD;
# All non-NULL rows should appear (not filtered out)
SELECT COUNT(*) FROM t_isnotnull_bigint WHERE val IS NOT NULL;
COUNT(*)
5
SELECT * FROM t_isnotnull_bigint WHERE val IS NOT NULL ORDER BY id;
id	val
1	100
3	200
4	300
6	400
7	500
SELECT COUNT(*) FROM t_isnotnull_bigint WHERE val IS NULL;
COUNT(*)
3
SELECT * FROM t_isnotnull_bigint WHERE val IS NULL ORDER BY id;
id	val
2	NULL
5	NULL
8	NULL
DROP TABLE t_isnotnull_bigint;
# 6b: DOUBLE (double vectorized path, simd_width=4 with AVX2)
CREATE TABLE t_isnotnull_double (
id INT PRIMARY KEY,
val DOUBLE
) SECONDARY_ENGINE=RAPID;
INSERT INTO t_isnotnull_double VALUES
(1, 1.5), (2, NULL), (3, 2.5), (4, 3.5), (5, NULL), (6, 4.5), (7, 5.5), (8, NULL);
ALTER TABLE t_isnotnull_double SECONDARY_LOAD;
SELECT COUNT(*) FROM t_isnotnull_double WHERE val IS NOT NULL;
COUNT(*)
5
SELECT * FROM t_isnotnull_double WHERE val IS NOT NULL ORDER BY id;
id	val
1	1.5
3	2.5
4	3.5
6	4.5
7	5.5
SELECT COUNT(*) FROM t_isnotnull_double WHERE val IS NULL;
COUNT(*)
3
SELECT * FROM t_isnotnull_double WHERE val IS NULL ORDER BY id;
id	val
2	NULL
5	NULL
8	NULL
DROP TABLE t_isnotnull_double;
# 6c: DECIMAL (decimal vectorized path)
CREATE TABLE t_isnotnull_decimal (
id INT PRIMARY KEY,
val DECIMAL(10,2)
) SECONDARY_ENGINE=RAPID;
INSERT INTO t_isnotnull_decimal VALUES
(1, 10.50), (2, NULL), (3, 20.75), (4, 30.00), (5, NULL), (6, 40.25);
ALTER TABLE t_isnotnull_decimal SECONDARY_LOAD;
SELECT COUNT(*) FROM t_isnotnull_decimal WHERE val IS NOT NULL;
COUNT(*)
4
SELECT * FROM t_isnotnull_decimal WHERE val IS NOT NULL ORDER BY id;
id	val
1	10.50
3	20.75
4	30.00
6	40.25
SELECT COUNT(*) FROM t_isnotnull_decimal WHERE val IS NULL;
COUNT(*)
2
DROP TABLE t_isnotnull_decimal;
# 6d: FLOAT (goes through evaluate_double_vectorized)
CREATE TABLE t_isnotnull_float (
id INT PRIMARY KEY,
val FLOAT
) SECONDARY_ENGINE=RAPID;
INSERT INTO t_isnotnull_float VALUES
(1, 1.1), (2, NULL), (3, 2.2), (4, 3.3), (5, NULL), (6, 4.4);
ALTER TABLE t_isnotnull_float SECONDARY_LOAD;
SELECT COUNT(*) FROM t_isnotnull_float WHERE val IS NOT NULL;
COUNT(*)
4
SELECT * FROM t_isnotnull_float WHERE val IS NOT NULL ORDER BY id;
id	val
1	1.1
3	2.2
4	3.3
6	4.4
SELECT COUNT(*) FROM t_isnotnull_float WHERE val IS NULL;
COUNT(*)
2
DROP TABLE t_isnotnull_float;
# 6e: INT (int32 vectorized path, simd_width=4 with NEON; x86 AVX2 was correct)
CREATE TABLE t_isnotnull_int (
id INT PRIMARY KEY,
val INT
) SECONDARY_ENGINE=RAPID;
INSERT INTO t_isnotnull_int VALUES
(1, 10), (2, NULL), (3, 20), (4, 30), (5, NULL), (6, 40), (7, 50), (8, NULL);
ALTER TABLE t_isnotnull_int SECONDARY_LOAD;
SELECT COUNT(*) FROM t_isnotnull_int WHERE val IS NOT NULL;
COUNT(*)
5
SELECT * FROM t_isnotnull_int WHERE val IS NOT NULL ORDER BY id;
id	val
1	10
3	20
4	30
6	40
7	50
SELECT COUNT(*) FROM t_isnotnull_int WHERE val IS NULL;
COUNT(*)
3
DROP TABLE t_isnotnull_int;
########################################################################
# Bug 11: VARCHAR field_length boundary off-by-one
#
# The extract_field_data() function used fld->field_length > 256 to
# decide between 1-byte vs 2-byte length prefix for VARCHAR/VAR_STRING.
# MySQL's Field_varstring::get_length_bytes() uses >= 256 (> 255).
# For field_length == 256 exactly, the code read only 1 byte of a 
# 2-byte prefix, producing garbage length and data.
#
# This test creates VARCHAR(255) and VARCHAR(256) columns, inserts 
# multi-byte text that exercises the full column width, and verifies
# the data round-trips correctly.
########################################################################
# 11a: VARCHAR(255) — should always have been fine
CREATE TABLE t_varchar255 (
id INT PRIMARY KEY,
v VARCHAR(255)
) SECONDARY_ENGINE=RAPID;
INSERT INTO t_varchar255 VALUES
(1, REPEAT('A', 255)),
(2, REPEAT('B', 128)),
(3, 'short'),
(4, '');
ALTER TABLE t_varchar255 SECONDARY_LOAD;
SELECT id, LENGTH(v) FROM t_varchar255 ORDER BY id;
id	LENGTH(v)
1	255
2	128
3	5
4	0
SELECT id FROM t_varchar255 WHERE v LIKE REPEAT('A', 10) || '%';
id
DROP TABLE t_varchar255;
# 11b: VARCHAR(256) — the exact boundary that was buggy
CREATE TABLE t_varchar256 (
id INT PRIMARY KEY,
v VARCHAR(256)
) SECONDARY_ENGINE=RAPID;
INSERT INTO t_varchar256 VALUES
(1, REPEAT('A', 256)),
(2, REPEAT('B', 128)),
(3, 'short'),
(4, '');
ALTER TABLE t_varchar256 SECONDARY_LOAD;
# Verify exact data is preserved (would be garbage with the off-by-one)
SELECT id, LENGTH(v) FROM t_varchar256 ORDER BY id;
id	LENGTH(v)
1	256
2	128
3	5
4	0
SELECT id FROM t_varchar256 WHERE v LIKE REPEAT('A', 10) || '%';
id
SELECT id FROM t_varchar256 WHERE v = REPEAT('A', 256);
id
1
DROP TABLE t_varchar256;
# 11c: VARCHAR(64) with utf8mb4 (64*4 = 256 bytes — also hits the boundary)
CREATE TABLE t_varchar64_utf8mb4 (
id INT PRIMARY KEY,
v VARCHAR(64)
) SECONDARY_ENGINE=RAPID;
INSERT INTO t_varchar64_utf8mb4 VALUES
(1, REPEAT('A', 64)),
(2, REPEAT('B', 32)),
(3, 'short');
ALTER TABLE t_varchar64_utf8mb4 SECONDARY_LOAD;
SELECT id, LENGTH(v) FROM t_varchar64_utf8mb4 ORDER BY id;
id	LENGTH(v)
1	64
2	32
3	5
SELECT id FROM t_varchar64_utf8mb4 WHERE v LIKE REPEAT('A', 5) || '%';
id
DROP TABLE t_varchar64_utf8mb4;
########################################################################
# Bug 24: ART zombie leaf after deleting the last key
#
# When ART_delete removed the only remaining key in the tree, the leaf
# was cleared (key/values emptied) but m_tree->root was never nullified.
# The next ART_insert would encounter a zombie leaf with key.size()==0,
# attempt leaf->key[0] on the empty vector, and crash (UB).
#
# This test does insert(k1) -> delete(k1) -> insert(k2) and verifies
# the second insert succeeds (no crash, correct data).
########################################################################
# 24a: Single-row insert-delete-insert cycle on INT PK
CREATE TABLE t_art_zombie (
id INT PRIMARY KEY,
val INT
) SECONDARY_ENGINE=RAPID;
INSERT INTO t_art_zombie VALUES (1, 100);
ALTER TABLE t_art_zombie SECONDARY_LOAD;
# Delete the only row
DELETE FROM t_art_zombie WHERE id = 1;
SELECT COUNT(*) FROM t_art_zombie;
COUNT(*)
0
# Insert a new row (this would crash if root is a zombie leaf)
INSERT INTO t_art_zombie VALUES (2, 200);
SELECT * FROM t_art_zombie ORDER BY id;
id	val
2	200
SELECT COUNT(*) FROM t_art_zombie;
COUNT(*)
1
# Insert another row and verify
INSERT INTO t_art_zombie VALUES (3, 300);
SELECT * FROM t_art_zombie ORDER BY id;
id	val
2	200
3	300
DROP TABLE t_art_zombie;
# 24b: Multiple insert-delete-insert cycles (stress test)
CREATE TABLE t_art_zombie2 (
id INT PRIMARY KEY,
val INT
) SECONDARY_ENGINE=RAPID;
INSERT INTO t_art_zombie2 VALUES (1, 10), (2, 20), (3, 30);
ALTER TABLE t_art_zombie2 SECONDARY_LOAD;
DELETE FROM t_art_zombie2 WHERE id IN (2, 3);
SELECT * FROM t_art_zombie2 ORDER BY id;
id	val
1	10
DELETE FROM t_art_zombie2 WHERE id = 1;
SELECT COUNT(*) FROM t_art_zombie2;
COUNT(*)
0
INSERT INTO t_art_zombie2 VALUES (5, 50);
SELECT * FROM t_art_zombie2 ORDER BY id;
id	val
5	50
DROP TABLE t_art_zombie2;
# 24c: VARCHAR primary key — same pattern
CREATE TABLE t_art_zombie_str (
code VARCHAR(20) PRIMARY KEY,
val INT
) SECONDARY_ENGINE=RAPID;
INSERT INTO t_art_zombie_str VALUES ('KEY-001', 100);
ALTER TABLE t_art_zombie_str SECONDARY_LOAD;
DELETE FROM t_art_zombie_str WHERE code = 'KEY-001';
SELECT COUNT(*) FROM t_art_zombie_str;
COUNT(*)
0
INSERT INTO t_art_zombie_str VALUES ('KEY-002', 200);
SELECT * FROM t_art_zombie_str ORDER BY code;
code	val
KEY-002	200
INSERT INTO t_art_zombie_str VALUES ('KEY-003', 300);
SELECT * FROM t_art_zombie_str ORDER BY code;
code	val
KEY-002	200
KEY-003	300
DROP TABLE t_art_zombie_str;
########################################################################
# Bug 7: insert_row retry return-value not checked
#
# Table::insert_row() had a retry path when the first IMCU was full,
# but the second insert_row() call's return value was unchecked.
# This could lead to garbage rowids used for index building.
#
# This test fills an IMCU to near-capacity and then inserts more rows,
# triggering the retry path and verifying correctness.
########################################################################
# Insert enough rows to exercise the IMCU-full retry path
CREATE TABLE t_insert_retry (
id INT PRIMARY KEY,
data VARCHAR(200)
) SECONDARY_ENGINE=RAPID;
# Insert a batch large enough to fill the first IMCU and spill
ALTER TABLE t_insert_retry SECONDARY_LOAD;
SELECT COUNT(*) FROM t_insert_retry;
COUNT(*)
500
SELECT MIN(id), MAX(id) FROM t_insert_retry;
MIN(id)	MAX(id)
SELECT id FROM t_insert_retry WHERE id IN (1, 250, 500) ORDER BY id;
id
1
250
500
DROP TABLE t_insert_retry;
########################################################################
# Bug 22: update_string_stats empty() sentinel
#
# update_string_stats() used .empty() to distinguish "uninitialized"
# from legitimate empty-string values. The fix adds an explicit
# has_string_seen flag. While string min/max is not yet used for
# pruning (TODO branch), the fix prevents future silent corruption.
########################################################################
CREATE TABLE t_empty_string (
id INT PRIMARY KEY,
label VARCHAR(50)
) SECONDARY_ENGINE=RAPID;
INSERT INTO t_empty_string VALUES (1, ''), (2, 'apple'), (3, 'banana'), (4, 'cherry');
ALTER TABLE t_empty_string SECONDARY_LOAD;
# Empty string should be retrievable and comparable
SELECT * FROM t_empty_string ORDER BY id;
id	label
1	
2	apple
3	banana
4	cherry
SELECT * FROM t_empty_string WHERE label = '';
id	label
1	
SELECT * FROM t_empty_string WHERE label > '' ORDER BY label;
id	label
2	apple
3	banana
4	cherry
SELECT * FROM t_empty_string WHERE label >= '' ORDER BY label;
id	label
1	
2	apple
3	banana
4	cherry
DROP TABLE t_empty_string;
DROP DATABASE sh_bugfixes;
