DROP DATABASE IF EXISTS sh_jbd;
Warnings:
Note	1008	Can't drop database 'sh_jbd'; database doesn't exist
CREATE DATABASE sh_jbd;
USE sh_jbd;
CALL mtr.add_suppression("Rapid immediate COPY_INFO quarantined");
CREATE TABLE t_jbd (
id INT PRIMARY KEY,
bin VARBINARY(16),
j JSON,
d DECIMAL(18,6),
name VARCHAR(64)
) SECONDARY_ENGINE=RAPID;
INSERT INTO t_jbd VALUES
(1, UNHEX('00112233445566778899AABBCCDDEEFF'), JSON_OBJECT('k', 1), 123456.123456, 'orig1'),
(2, UNHEX('FFEEDDCCBBAA99887766554433221100'), JSON_OBJECT('k', 2), 0.000001, 'orig2');
ALTER TABLE t_jbd SECONDARY_LOAD;
SET SESSION USE_SECONDARY_ENGINE=OFF;
BEGIN;
UPDATE t_jbd SET bin = UNHEX('AAAAAAAAAAAAAAAAAAAAAAAAAAAAAAAA'), j = JSON_OBJECT('z', 9999), d = 99999.999999, name = 'tx1' WHERE id = 1;
SELECT id, HEX(bin), JSON_EXTRACT(j, '$.z'), d, name FROM t_jbd WHERE id = 1;
id	HEX(bin)	JSON_EXTRACT(j, '$.z')	d	name
1	AAAAAAAAAAAAAAAAAAAAAAAAAAAAAAAA	9999	99999.999999	tx1
SET SESSION USE_SECONDARY_ENGINE=FORCED;
SELECT id, HEX(bin), JSON_EXTRACT(j, '$.z'), d, name FROM t_jbd WHERE id = 1;
id	HEX(bin)	JSON_EXTRACT(j, '$.z')	d	name
1	00112233445566778899AABBCCDDEEFF	NULL	123456.123456	orig1
SAVEPOINT sp_j1;
UPDATE t_jbd SET d = d + 0.000001 WHERE id = 1;
SELECT d FROM t_jbd WHERE id = 1;
d
100000.000000
ROLLBACK TO SAVEPOINT sp_j1;
SELECT d FROM t_jbd WHERE id = 1;
d
99999.999999
ROLLBACK;
SET SESSION USE_SECONDARY_ENGINE=FORCED;
SELECT id, HEX(bin), JSON_EXTRACT(j, '$.z'), d, name FROM t_jbd WHERE id = 1;
ERROR HY000: Secondary engine operation failed. table has failed DML propagation and must be reloaded.
ALTER TABLE t_jbd SECONDARY_UNLOAD;
ALTER TABLE t_jbd SECONDARY_LOAD;
SELECT id, HEX(bin), JSON_EXTRACT(j, '$.z'), d, name FROM t_jbd WHERE id = 1;
id	HEX(bin)	JSON_EXTRACT(j, '$.z')	d	name
1	00112233445566778899AABBCCDDEEFF	NULL	123456.123456	orig1
SET SESSION USE_SECONDARY_ENGINE=OFF;
BEGIN;
UPDATE t_jbd SET bin = UNHEX('DEADBEEFDEADBEEFDEADBEEFDEADBEEF'), j = JSON_OBJECT('z', 42), d = 42.424242, name = 'committed' WHERE id = 2;
COMMIT;
SET SESSION USE_SECONDARY_ENGINE=FORCED;
SELECT id, HEX(bin), JSON_EXTRACT(j, '$.z'), d, name FROM t_jbd WHERE id = 2;
id	HEX(bin)	JSON_EXTRACT(j, '$.z')	d	name
2	DEADBEEFDEADBEEFDEADBEEFDEADBEEF	42	42.424242	committed
SET SESSION USE_SECONDARY_ENGINE=OFF;
BEGIN;
UPDATE t_jbd SET name = 'tmp' WHERE id = 1;
SAVEPOINT sp_after;
COMMIT;
DROP TABLE t_jbd;
DROP DATABASE sh_jbd;
