create database sh_pop_basic;
use sh_pop_basic;
SET USE_SECONDARY_ENGINE=FORCED;
########################################################################
# Test 1: Basic INSERT propagation after load
########################################################################
CREATE TABLE t_pop_insert (
id INT PRIMARY KEY,
name VARCHAR(50),
value INT
) SECONDARY_ENGINE=RAPID;
INSERT INTO t_pop_insert VALUES (1, 'pre_load_1', 100), (2, 'pre_load_2', 200);
ALTER TABLE t_pop_insert SECONDARY_LOAD;
SELECT * FROM t_pop_insert ORDER BY id;
id	name	value
1	pre_load_1	100
2	pre_load_2	200
INSERT INTO t_pop_insert VALUES (3, 'post_load_1', 300);
SELECT * FROM t_pop_insert ORDER BY id;
id	name	value
1	pre_load_1	100
2	pre_load_2	200
3	post_load_1	300
SELECT COUNT(*) FROM t_pop_insert;
COUNT(*)
3
INSERT INTO t_pop_insert VALUES (4, 'post_load_2', 400), (5, 'post_load_3', 500);
SELECT * FROM t_pop_insert ORDER BY id;
id	name	value
1	pre_load_1	100
2	pre_load_2	200
3	post_load_1	300
4	post_load_2	400
5	post_load_3	500
SELECT COUNT(*) FROM t_pop_insert;
COUNT(*)
5
SELECT * FROM t_pop_insert WHERE value > 200 ORDER BY id;
id	name	value
3	post_load_1	300
4	post_load_2	400
5	post_load_3	500
DROP TABLE t_pop_insert;
########################################################################
# Test 2: Basic UPDATE propagation after load
########################################################################
CREATE TABLE t_pop_update (
id INT PRIMARY KEY,
name VARCHAR(50),
score INT,
status VARCHAR(20) DEFAULT 'active'
) SECONDARY_ENGINE=RAPID;
INSERT INTO t_pop_update VALUES
(1, 'Alice', 80, 'active'),
(2, 'Bob', 90, 'active'),
(3, 'Charlie', 70, 'inactive');
ALTER TABLE t_pop_update SECONDARY_LOAD;
SELECT * FROM t_pop_update ORDER BY id;
id	name	score	status
1	Alice	80	active
2	Bob	90	active
3	Charlie	70	inactive
UPDATE t_pop_update SET score = 95 WHERE id = 1;
SELECT * FROM t_pop_update WHERE id = 1;
id	name	score	status
1	Alice	95	active
SELECT * FROM t_pop_update ORDER BY id;
id	name	score	status
1	Alice	95	active
2	Bob	90	active
3	Charlie	70	inactive
UPDATE t_pop_update SET name = 'Bobby', score = 85, status = 'active' WHERE id = 2;
SELECT * FROM t_pop_update WHERE id = 2;
id	name	score	status
2	Bobby	85	active
SELECT * FROM t_pop_update ORDER BY id;
id	name	score	status
1	Alice	95	active
2	Bobby	85	active
3	Charlie	70	inactive
UPDATE t_pop_update SET score = score + 5 WHERE status = 'active';
SELECT * FROM t_pop_update ORDER BY id;
id	name	score	status
1	Alice	100	active
2	Bobby	90	active
3	Charlie	70	inactive
UPDATE t_pop_update SET status = NULL WHERE id = 3;
SELECT * FROM t_pop_update WHERE status IS NULL;
id	name	score	status
3	Charlie	70	NULL
SELECT * FROM t_pop_update ORDER BY id;
id	name	score	status
1	Alice	100	active
2	Bobby	90	active
3	Charlie	70	NULL
DROP TABLE t_pop_update;
########################################################################
# Test 3: Basic DELETE propagation after load
########################################################################
CREATE TABLE t_pop_delete (
id INT PRIMARY KEY,
name VARCHAR(50),
score INT
) SECONDARY_ENGINE=RAPID;
INSERT INTO t_pop_delete VALUES
(1, 'Alice', 100),
(2, 'Bob', 200),
(3, 'Charlie', 300),
(4, 'David', 400),
(5, 'Eve', 500);
ALTER TABLE t_pop_delete SECONDARY_LOAD;
SELECT * FROM t_pop_delete ORDER BY id;
id	name	score
1	Alice	100
2	Bob	200
3	Charlie	300
4	David	400
5	Eve	500
SELECT COUNT(*) FROM t_pop_delete;
COUNT(*)
5
DELETE FROM t_pop_delete WHERE id = 3;
SELECT * FROM t_pop_delete ORDER BY id;
id	name	score
1	Alice	100
2	Bob	200
4	David	400
5	Eve	500
SELECT COUNT(*) FROM t_pop_delete;
COUNT(*)
4
DELETE FROM t_pop_delete WHERE score < 300;
SELECT * FROM t_pop_delete ORDER BY id;
id	name	score
4	David	400
5	Eve	500
SELECT COUNT(*) FROM t_pop_delete;
COUNT(*)
2
DELETE FROM t_pop_delete;
SELECT * FROM t_pop_delete;
id	name	score
SELECT COUNT(*) FROM t_pop_delete;
COUNT(*)
0
DROP TABLE t_pop_delete;
########################################################################
# Test 4: Mixed DML propagation (INSERT + UPDATE + DELETE)
########################################################################
CREATE TABLE t_pop_mixed (
id INT PRIMARY KEY,
counter INT DEFAULT 0,
tag VARCHAR(20)
) SECONDARY_ENGINE=RAPID;
INSERT INTO t_pop_mixed VALUES
(1, 0, 'alpha'),
(2, 0, 'beta'),
(3, 0, 'gamma');
ALTER TABLE t_pop_mixed SECONDARY_LOAD;
SELECT * FROM t_pop_mixed ORDER BY id;
id	counter	tag
1	0	alpha
2	0	beta
3	0	gamma
DELETE FROM t_pop_mixed WHERE id = 1;
INSERT INTO t_pop_mixed VALUES (4, 100, 'delta');
UPDATE t_pop_mixed SET counter = counter + 1 WHERE tag LIKE '%a%';
SELECT * FROM t_pop_mixed ORDER BY id;
id	counter	tag
2	1	beta
3	1	gamma
4	101	delta
DELETE FROM t_pop_mixed WHERE counter > 0;
INSERT INTO t_pop_mixed VALUES (5, 50, 'epsilon'), (6, 60, 'zeta');
SELECT * FROM t_pop_mixed ORDER BY id;
id	counter	tag
5	50	epsilon
6	60	zeta
SELECT COUNT(*) FROM t_pop_mixed;
COUNT(*)
2
DROP TABLE t_pop_mixed;
########################################################################
# Test 5: Propagation with composite primary key
########################################################################
CREATE TABLE t_pop_composite (
dept_id INT,
emp_id INT,
name VARCHAR(50),
salary DECIMAL(10,2),
PRIMARY KEY (dept_id, emp_id)
) SECONDARY_ENGINE=RAPID;
INSERT INTO t_pop_composite VALUES
(1, 101, 'Alice', 5000.00),
(1, 102, 'Bob', 6000.00),
(2, 101, 'Charlie', 5500.00);
ALTER TABLE t_pop_composite SECONDARY_LOAD;
SELECT * FROM t_pop_composite ORDER BY dept_id, emp_id;
dept_id	emp_id	name	salary
1	101	Alice	5000.00
1	102	Bob	6000.00
2	101	Charlie	5500.00
INSERT INTO t_pop_composite VALUES (2, 102, 'David', 7000.00);
SELECT * FROM t_pop_composite ORDER BY dept_id, emp_id;
dept_id	emp_id	name	salary
1	101	Alice	5000.00
1	102	Bob	6000.00
2	101	Charlie	5500.00
2	102	David	7000.00
UPDATE t_pop_composite SET salary = 6500.00 WHERE dept_id = 1 AND emp_id = 101;
SELECT * FROM t_pop_composite WHERE dept_id = 1 ORDER BY emp_id;
dept_id	emp_id	name	salary
1	101	Alice	6500.00
1	102	Bob	6000.00
DELETE FROM t_pop_composite WHERE dept_id = 1 AND emp_id = 102;
SELECT * FROM t_pop_composite ORDER BY dept_id, emp_id;
dept_id	emp_id	name	salary
1	101	Alice	6500.00
2	101	Charlie	5500.00
2	102	David	7000.00
DROP TABLE t_pop_composite;
########################################################################
# Test 6: Propagation with string primary key
########################################################################
CREATE TABLE t_pop_strpk (
code VARCHAR(10) PRIMARY KEY,
quantity INT,
description VARCHAR(100)
) SECONDARY_ENGINE=RAPID;
INSERT INTO t_pop_strpk VALUES
('A001', 100, 'Item A'),
('B001', 200, 'Item B');
ALTER TABLE t_pop_strpk SECONDARY_LOAD;
SELECT * FROM t_pop_strpk ORDER BY code;
code	quantity	description
A001	100	Item A
B001	200	Item B
INSERT INTO t_pop_strpk VALUES ('C001', 300, 'Item C');
SELECT * FROM t_pop_strpk ORDER BY code;
code	quantity	description
A001	100	Item A
B001	200	Item B
C001	300	Item C
UPDATE t_pop_strpk SET quantity = 150 WHERE code = 'A001';
SELECT * FROM t_pop_strpk ORDER BY code;
code	quantity	description
A001	150	Item A
B001	200	Item B
C001	300	Item C
DELETE FROM t_pop_strpk WHERE code = 'B001';
SELECT * FROM t_pop_strpk ORDER BY code;
code	quantity	description
A001	150	Item A
C001	300	Item C
DROP TABLE t_pop_strpk;
########################################################################
# Test 7: Propagation with secondary indexes
########################################################################
CREATE TABLE t_pop_idx (
id INT PRIMARY KEY,
name VARCHAR(50),
dept VARCHAR(20),
salary DECIMAL(10,2),
INDEX idx_dept (dept),
INDEX idx_salary (salary)
) SECONDARY_ENGINE=RAPID;
INSERT INTO t_pop_idx VALUES
(1, 'Alice', 'Eng', 8000.00),
(2, 'Bob', 'Sales', 6000.00),
(3, 'Charlie', 'Eng', 9000.00);
ALTER TABLE t_pop_idx SECONDARY_LOAD;
SELECT * FROM t_pop_idx WHERE dept = 'Eng' ORDER BY id;
id	name	dept	salary
1	Alice	Eng	8000.00
3	Charlie	Eng	9000.00
INSERT INTO t_pop_idx VALUES (4, 'David', 'Eng', 7500.00);
SELECT * FROM t_pop_idx WHERE dept = 'Eng' ORDER BY id;
id	name	dept	salary
1	Alice	Eng	8000.00
3	Charlie	Eng	9000.00
4	David	Eng	7500.00
UPDATE t_pop_idx SET dept = 'Eng', salary = 8500.00 WHERE id = 2;
SELECT * FROM t_pop_idx WHERE dept = 'Eng' ORDER BY id;
id	name	dept	salary
1	Alice	Eng	8000.00
3	Charlie	Eng	9000.00
4	David	Eng	7500.00
SELECT * FROM t_pop_idx WHERE dept = 'Sales';
id	name	dept	salary
2	Bob	Eng	8500.00
DELETE FROM t_pop_idx WHERE id = 3;
SELECT * FROM t_pop_idx WHERE dept = 'Eng' ORDER BY id;
id	name	dept	salary
1	Alice	Eng	8000.00
4	David	Eng	7500.00
4	David	Eng	7500.00
SELECT COUNT(*) FROM t_pop_idx;
COUNT(*)
3
DROP TABLE t_pop_idx;
########################################################################
# Test 8: Propagation of NULL values
########################################################################
CREATE TABLE t_pop_null (
id INT PRIMARY KEY,
c1 INT,
c2 VARCHAR(50),
c3 DOUBLE
) SECONDARY_ENGINE=RAPID;
INSERT INTO t_pop_null VALUES
(1, 10, 'hello', 1.5),
(2, 20, 'world', 2.5),
(3, 30, 'test', 3.5);
ALTER TABLE t_pop_null SECONDARY_LOAD;
SELECT * FROM t_pop_null ORDER BY id;
id	c1	c2	c3
1	10	hello	1.5
2	20	world	2.5
3	30	test	3.5
UPDATE t_pop_null SET c1 = NULL, c2 = NULL WHERE id = 1;
SELECT * FROM t_pop_null ORDER BY id;
id	c1	c2	c3
1	NULL	NULL	1.5
2	20	world	2.5
3	30	test	3.5
INSERT INTO t_pop_null VALUES (4, NULL, NULL, NULL);
SELECT * FROM t_pop_null WHERE c1 IS NULL ORDER BY id;
id	c1	c2	c3
1	NULL	NULL	1.5
4	NULL	NULL	NULL
SELECT COUNT(*) FROM t_pop_null;
COUNT(*)
4
UPDATE t_pop_null SET c1 = 40, c3 = 4.5 WHERE id = 4;
SELECT * FROM t_pop_null ORDER BY id;
id	c1	c2	c3
1	NULL	NULL	1.5
2	20	world	2.5
3	30	test	3.5
4	40	NULL	4.5
DROP TABLE t_pop_null;
SET USE_SECONDARY_ENGINE=OFF;
DROP DATABASE sh_pop_basic;
