create database sh_pop_stress;
use sh_pop_stress;
SET USE_SECONDARY_ENGINE=FORCED;
########################################################################
# Test 1: Concurrent INSERT from two connections
########################################################################
CREATE TABLE t_pop_concurrent_insert (
id INT PRIMARY KEY,
conn_id INT,
seq INT,
data VARCHAR(50)
) SECONDARY_ENGINE=RAPID;
INSERT INTO t_pop_concurrent_insert VALUES (0, 0, 0, 'seed');
ALTER TABLE t_pop_concurrent_insert SECONDARY_LOAD;
SET USE_SECONDARY_ENGINE=FORCED;
SET USE_SECONDARY_ENGINE=FORCED;
SELECT COUNT(*) FROM t_pop_concurrent_insert;
COUNT(*)
201
SELECT COUNT(*) FROM t_pop_concurrent_insert WHERE conn_id = 1;
COUNT(*)
100
SELECT COUNT(*) FROM t_pop_concurrent_insert WHERE conn_id = 2;
COUNT(*)
100
SELECT id, conn_id, data FROM t_pop_concurrent_insert ORDER BY id LIMIT 10;
id	conn_id	data
0	0	seed
1	1	conn_a_1
2	1	conn_a_2
3	1	conn_a_3
4	1	conn_a_4
5	1	conn_a_5
6	1	conn_a_6
7	1	conn_a_7
8	1	conn_a_8
9	1	conn_a_9
SELECT id, conn_id, data FROM t_pop_concurrent_insert WHERE id >= 190 ORDER BY id;
id	conn_id	data
190	2	conn_b_190
191	2	conn_b_191
192	2	conn_b_192
193	2	conn_b_193
194	2	conn_b_194
195	2	conn_b_195
196	2	conn_b_196
197	2	conn_b_197
198	2	conn_b_198
199	2	conn_b_199
200	2	conn_b_200
DROP TABLE t_pop_concurrent_insert;
########################################################################
# Test 2: Concurrent UPDATE/DELETE on same rows
########################################################################
CREATE TABLE t_pop_concurrent_ud (
id INT PRIMARY KEY,
counter INT DEFAULT 0,
last_writer VARCHAR(20)
) SECONDARY_ENGINE=RAPID;
INSERT INTO t_pop_concurrent_ud VALUES
(1, 0, 'init'), (2, 0, 'init'), (3, 0, 'init'), (4, 0, 'init'), (5, 0, 'init');
ALTER TABLE t_pop_concurrent_ud SECONDARY_LOAD;
SET USE_SECONDARY_ENGINE=FORCED;
UPDATE t_pop_concurrent_ud SET counter = counter + 1, last_writer = 'conn_c' WHERE id IN (1, 2, 3);
DELETE FROM t_pop_concurrent_ud WHERE id = 4;
INSERT INTO t_pop_concurrent_ud VALUES (6, 10, 'conn_c');
SET USE_SECONDARY_ENGINE=FORCED;
UPDATE t_pop_concurrent_ud SET counter = counter + 2, last_writer = 'conn_d' WHERE id IN (2, 3, 5);
DELETE FROM t_pop_concurrent_ud WHERE id = 1;
INSERT INTO t_pop_concurrent_ud VALUES (7, 20, 'conn_d');
SELECT * FROM t_pop_concurrent_ud ORDER BY id;
id	counter	last_writer
2	3	conn_d
3	3	conn_d
5	2	conn_d
6	10	conn_c
7	20	conn_d
SELECT COUNT(*) FROM t_pop_concurrent_ud;
COUNT(*)
5
DROP TABLE t_pop_concurrent_ud;
########################################################################
# Test 3: Rapid-fire small transactions (stress ringbuffer)
########################################################################
CREATE TABLE t_pop_rapidfire (
id INT PRIMARY KEY,
val INT
) SECONDARY_ENGINE=RAPID;
ALTER TABLE t_pop_rapidfire SECONDARY_LOAD;
SELECT COUNT(*) FROM t_pop_rapidfire;
COUNT(*)
500
SELECT MIN(val), MAX(val), AVG(val) FROM t_pop_rapidfire;
MIN(val)	MAX(val)	AVG(val)
1	500	250.5000
SELECT * FROM t_pop_rapidfire WHERE val BETWEEN 100 AND 110 ORDER BY id;
id	val
100	100
101	101
102	102
103	103
104	104
105	105
106	106
107	107
108	108
109	109
110	110
SELECT val FROM t_pop_rapidfire WHERE id <= 10 ORDER BY id;
val
2
4
6
8
10
12
14
16
18
20
SELECT COUNT(*) FROM t_pop_rapidfire WHERE val > 100;
COUNT(*)
450
SELECT COUNT(*) FROM t_pop_rapidfire;
COUNT(*)
399
SELECT MAX(id) FROM t_pop_rapidfire;
MAX(id)
DROP TABLE t_pop_rapidfire;
########################################################################
# Test 4: Large batch INSERT → verify propagation completeness
########################################################################
CREATE TABLE t_pop_large (
id INT PRIMARY KEY AUTO_INCREMENT,
val INT,
padding CHAR(100) DEFAULT 'x'
) SECONDARY_ENGINE=RAPID;
ALTER TABLE t_pop_large SECONDARY_LOAD;
SELECT COUNT(*) FROM t_pop_large;
COUNT(*)
1000
SELECT MIN(id), MAX(id) FROM t_pop_large;
MIN(id)	MAX(id)
SELECT SUM(val) FROM t_pop_large;
SUM(val)
500500
SELECT COUNT(*) FROM t_pop_large WHERE id BETWEEN 1 AND 1000;
COUNT(*)
1000
DROP TABLE t_pop_large;
########################################################################
# Test 5: Propagation consistency: UPDATE then immediately SELECT
########################################################################
CREATE TABLE t_pop_consistency (
id INT PRIMARY KEY,
val INT,
version INT DEFAULT 0
) SECONDARY_ENGINE=RAPID;
INSERT INTO t_pop_consistency VALUES (1, 10, 0), (2, 20, 0), (3, 30, 0);
ALTER TABLE t_pop_consistency SECONDARY_LOAD;
UPDATE t_pop_consistency SET val = 11, version = 1 WHERE id = 1;
UPDATE t_pop_consistency SET val = 21, version = 1 WHERE id = 2;
UPDATE t_pop_consistency SET val = 12, version = 2 WHERE id = 1;
DELETE FROM t_pop_consistency WHERE id = 3;
INSERT INTO t_pop_consistency VALUES (4, 40, 0);
SELECT * FROM t_pop_consistency ORDER BY id;
id	val	version
1	12	2
2	21	1
4	40	0
SELECT COUNT(*) FROM t_pop_consistency;
COUNT(*)
3
DROP TABLE t_pop_consistency;
########################################################################
# Test 6: Propagation on table with all numeric types
########################################################################
CREATE TABLE t_pop_types (
id INT PRIMARY KEY,
c_tinyint TINYINT,
c_smallint SMALLINT,
c_bigint BIGINT,
c_float FLOAT,
c_double DOUBLE,
c_decimal DECIMAL(10,2)
) SECONDARY_ENGINE=RAPID;
INSERT INTO t_pop_types VALUES
(1, -128, -32768, -9223372036854775808, -3.14, -3.1415926535, -9999.99),
(2, 0, 0, 0, 0.0, 0.0, 0.00),
(3, 127, 32767, 9223372036854775807, 3.14, 3.1415926535, 9999.99);
ALTER TABLE t_pop_types SECONDARY_LOAD;
SELECT * FROM t_pop_types ORDER BY id;
id	c_tinyint	c_smallint	c_bigint	c_float	c_double	c_decimal
1	-128	-32768	-9223372036854775808	-3.14	-3.1415926535	-9999.99
2	0	0	0	0	0	0.00
3	127	32767	9223372036854775807	3.14	3.1415926535	9999.99
INSERT INTO t_pop_types VALUES (4, -1, -1, -1, -1.0, -1.0, -1.00);
SELECT * FROM t_pop_types WHERE id = 4;
id	c_tinyint	c_smallint	c_bigint	c_float	c_double	c_decimal
4	-1	-1	-1	-1	-1	-1.00
UPDATE t_pop_types SET c_tinyint = 64, c_bigint = 1000000, c_double = 2.71828 WHERE id = 1;
SELECT * FROM t_pop_types WHERE id = 1;
id	c_tinyint	c_smallint	c_bigint	c_float	c_double	c_decimal
1	64	-32768	1000000	-3.14	2.71828	-9999.99
DROP TABLE t_pop_types;
########################################################################
# Test 7: UNLOAD/reload with propagation
########################################################################
CREATE TABLE t_pop_reload (
id INT PRIMARY KEY,
val INT
) SECONDARY_ENGINE=RAPID;
INSERT INTO t_pop_reload VALUES (1, 100), (2, 200);
ALTER TABLE t_pop_reload SECONDARY_LOAD;
SELECT * FROM t_pop_reload ORDER BY id;
id	val
1	100
2	200
INSERT INTO t_pop_reload VALUES (3, 300);
UPDATE t_pop_reload SET val = 150 WHERE id = 1;
SELECT * FROM t_pop_reload ORDER BY id;
id	val
1	150
2	200
3	300
ALTER TABLE t_pop_reload SECONDARY_UNLOAD;
SELECT * FROM t_pop_reload ORDER BY id;
ERROR HY000: Table has not been loaded
INSERT INTO t_pop_reload VALUES (4, 400);
DELETE FROM t_pop_reload WHERE id = 2;
ALTER TABLE t_pop_reload SECONDARY_LOAD;
SELECT * FROM t_pop_reload ORDER BY id;
id	val
1	150
3	300
4	400
SELECT COUNT(*) FROM t_pop_reload;
COUNT(*)
3
DROP TABLE t_pop_reload;
########################################################################
# Test 8: Propagation after table truncation [negative test]
########################################################################
CREATE TABLE t_pop_truncate (
id INT PRIMARY KEY,
val INT
) SECONDARY_ENGINE=RAPID;
INSERT INTO t_pop_truncate VALUES (1, 100), (2, 200), (3, 300);
ALTER TABLE t_pop_truncate SECONDARY_LOAD;
SELECT COUNT(*) FROM t_pop_truncate;
COUNT(*)
3
DELETE FROM t_pop_truncate;
SELECT COUNT(*) FROM t_pop_truncate;
COUNT(*)
0
INSERT INTO t_pop_truncate VALUES (4, 400), (5, 500);
SELECT * FROM t_pop_truncate ORDER BY id;
id	val
4	400
5	500
SELECT COUNT(*) FROM t_pop_truncate;
COUNT(*)
2
DROP TABLE t_pop_truncate;
SET USE_SECONDARY_ENGINE=OFF;
DROP DATABASE sh_pop_stress;
